{
 "schema_version": "1.0",
 "decoder_version": "decoding/0.3.1;parser=0.2;asr=437b8c03f291;second_pass=vote3@0.3",
 "recording": {
  "path": "/workspace/hfgcs-data/eval/samples/HFGCS_11175kHz_20260923T173253Z_eval-synthetic.wav",
  "sha256": "113a77c6bb383291d114bc845d206919462d04f79e4482cbf495ff1aa7b07a43",
  "schema": 2,
  "start_utc": "2026-09-23T17:32:53.000Z",
  "file_start_utc": "2026-09-23T17:32:53.000Z",
  "end_utc": "2026-09-23T17:39:07.297Z",
  "frequency_khz": 11175,
  "mode": "USB",
  "receiver_id": "eval-synthetic",
  "file": "HFGCS_11175kHz_20260923T173253Z_eval-synthetic.wav",
  "audio_rate": 8000,
  "duration_sec": 374.297,
  "preroll_sec": 0.0,
  "snr_db_peak": null,
  "snr_db_mean": null,
  "noise_floor_db": null,
  "truncated": false,
  "notes": "SYNTHETIC: gold eam-356f1a01 (EAM) + 2 s silence + gold eam-86d80b13 (EAM), concatenated; missileer.watch CC0-1.0"
 },
 "duration_s": 374.297,
 "decoded_at": "2026-10-27T00:53:14Z",
 "asr": {
  "model": "small.en",
  "compute_type": "float32",
  "config_key": "437b8c03f291",
  "decoder_version": "decoding/0.3.1;parser=0.2;asr=437b8c03f291;second_pass=vote3@0.3",
  "day_callsigns": [],
  "duration_s": 374.297125,
  "asr_seconds": 274.6,
  "text": "Alpha Uniform Lima, stand by. Alpha Charlie Four Alpha Uniform Lima, stand by. Alpha Charlie Four Alpha Uniform Lima, stand by. Alpha Charlie Four Alpha Uniform Lima Uniform Kilo Yankee Sierra Kilo India Victor Victor Sierra Four. Foxtrot X-ray Tree Papa Delta Romeo Keep to it. Seven Delta Echo Golf. I say again. Alpha Charlie Four Alpha Uniform Lima Uniform Kilo Yankee Sierra Kilo India Victor Sierra Four. Victor Tango Hotel Foxtrot X-ray Tree Papa Delta Romeo Victor Seven Delta Echo Golf. This is Cupway out. Out. All stations, all stations. This is Sockhole, Sockhole Freak Quebec Hotel Beautiful Delta Sierra Two S -ray Quebec Hotel Beautiful Delta Sierra Two, Six Five, Quebec Hotel Beautiful Delta Sierra Two, Six Five, and the Follow us. Get back. Hotel. Uniform. Delta. Sierra. Two. Roast. Bravo. Kilo. Alpha. X-ray. Three. Delta. Alpha. Victor. Alpha. Delta. Five. Delta Center. Sierra. Juliet. Victor. Two. X-ray. Charlie. Lima. Zulu. Alpha. X-ray. Get back. Hotel. Beautiful. Delta. Sierra. Two. Bravo. Bravo. Kilo. Oscar. X -ray. Victor Three. Doll. Alpha. Victor. Alpha. Delta. Five. November. Sierra. Juliet. Victor. X-ray. X-ray. X-ray. Delta. X -ray. X -ray. Delta. X -ray. X -ray. Delta. X -ray. X -ray. Delta. Zulu, Alpha, this is Star -Called Power. Delta.",
  "segments": [
   {
    "start": 1.0,
    "end": 30.68,
    "text": "Alpha Uniform Lima, stand by. Alpha Charlie Four Alpha Uniform Lima, stand by. Alpha Charlie Four Alpha Uniform Lima, stand by.",
    "avg_logprob": -0.26748455067475635,
    "no_speech_prob": 0.11758632957935333,
    "word_span": [
     0,
     20
    ]
   },
   {
    "start": 36.06,
    "end": 58.66,
    "text": "Alpha Charlie Four Alpha Uniform Lima Uniform Kilo Yankee Sierra Kilo India Victor Victor Sierra Four.",
    "avg_logprob": -0.3623820076818052,
    "no_speech_prob": 0.5990617871284485,
    "word_span": [
     21,
     36
    ]
   },
   {
    "start": 63.7,
    "end": 80.84,
    "text": "Foxtrot X-ray Tree Papa Delta Romeo Keep to it. Seven Delta Echo Golf.",
    "avg_logprob": -0.4752092698346014,
    "no_speech_prob": 0.5873082876205444,
    "word_span": [
     37,
     50
    ]
   },
   {
    "start": 80.84,
    "end": 109.84,
    "text": "I say again. Alpha Charlie Four Alpha Uniform Lima Uniform Kilo Yankee Sierra Kilo India Victor Sierra Four.",
    "avg_logprob": -0.15026962280273437,
    "no_speech_prob": 0.573969841003418,
    "word_span": [
     51,
     68
    ]
   },
   {
    "start": 111.84,
    "end": 133.44,
    "text": "Victor Tango Hotel Foxtrot X-ray Tree Papa Delta Romeo Victor Seven Delta Echo Golf.",
    "avg_logprob": -0.20604185573756695,
    "no_speech_prob": 0.447685569524765,
    "word_span": [
     69,
     83
    ]
   },
   {
    "start": 133.44,
    "end": 138.98,
    "text": "This is Cupway out.",
    "avg_logprob": -0.49921676847669816,
    "no_speech_prob": 0.35820668935775757,
    "word_span": [
     84,
     87
    ]
   },
   {
    "start": 163.12,
    "end": 164.52,
    "text": "Out.",
    "avg_logprob": -0.4910614013671875,
    "no_speech_prob": 0.13116618990898132,
    "word_span": [
     88,
     88
    ]
   },
   {
    "start": 177.58,
    "end": 179.92,
    "text": "All stations, all stations.",
    "avg_logprob": -0.22346581353081596,
    "no_speech_prob": 0.283617228269577,
    "word_span": [
     89,
     92
    ]
   },
   {
    "start": 179.92,
    "end": 209.18,
    "text": "This is Sockhole, Sockhole Freak Quebec Hotel Beautiful Delta Sierra Two S -ray Quebec Hotel Beautiful Delta Sierra",
    "avg_logprob": -0.6142983069786658,
    "no_speech_prob": 0.007238163147121668,
    "word_span": [
     93,
     110
    ]
   },
   {
    "start": 210.18,
    "end": 227.74,
    "text": "Two, Six Five, Quebec Hotel Beautiful Delta Sierra Two, Six Five, and the",
    "avg_logprob": -1.0510969576628313,
    "no_speech_prob": 0.003454947378486395,
    "word_span": [
     111,
     123
    ]
   },
   {
    "start": 226.92,
    "end": 250.24,
    "text": "Follow us. Get back. Hotel. Uniform. Delta. Sierra. Two. Roast. Bravo. Kilo. Alpha. X-ray.",
    "avg_logprob": -0.6406925092725193,
    "no_speech_prob": 0.009837012737989426,
    "word_span": [
     124,
     138
    ]
   },
   {
    "start": 254.24,
    "end": 281.34,
    "text": "Three. Delta. Alpha. Victor. Alpha. Delta. Five. Delta Center. Sierra. Juliet. Victor. Two. X-ray.",
    "avg_logprob": -0.44199651660341205,
    "no_speech_prob": 0.62738436460495,
    "word_span": [
     139,
     153
    ]
   },
   {
    "start": 286.46,
    "end": 315.54,
    "text": "Charlie. Lima. Zulu. Alpha. X-ray. Get back. Hotel. Beautiful. Delta. Sierra. Two. Bravo. Bravo.",
    "avg_logprob": -0.21701295717674143,
    "no_speech_prob": 0.6162381172180176,
    "word_span": [
     154,
     168
    ]
   },
   {
    "start": 314.54,
    "end": 331.42,
    "text": "Kilo. Oscar. X -ray. Victor Three. Doll.",
    "avg_logprob": -0.7998589277267456,
    "no_speech_prob": 0.007771741133183241,
    "word_span": [
     169,
     175
    ]
   },
   {
    "start": 330.54,
    "end": 353.44,
    "text": "Alpha. Victor. Alpha. Delta. Five. November. Sierra. Juliet. Victor. X-ray. X-ray. X-ray.",
    "avg_logprob": -0.26525090985438404,
    "no_speech_prob": 0.7656524181365967,
    "word_span": [
     176,
     190
    ]
   },
   {
    "start": 353.44,
    "end": 374.02,
    "text": "Delta. X -ray. X -ray. Delta. X -ray. X -ray. Delta. X -ray. X -ray. Delta.",
    "avg_logprob": -0.20776077058580186,
    "no_speech_prob": 0.27156755328178406,
    "word_span": [
     191,
     206
    ]
   },
   {
    "start": 359.14,
    "end": 367.64,
    "text": "Zulu, Alpha, this is Star -Called Power.",
    "avg_logprob": -0.8565463225046793,
    "no_speech_prob": 0.03189399465918541,
    "word_span": [
     207,
     213
    ]
   },
   {
    "start": 374.02,
    "end": 374.24,
    "text": "Delta.",
    "avg_logprob": -0.03537223784513371,
    "no_speech_prob": 0.6701622009277344,
    "word_span": [
     214,
     214
    ]
   }
  ],
  "words": [
   {
    "word": "Alpha",
    "start": 1.0,
    "end": 2.1,
    "probability": 0.4851
   },
   {
    "word": "Uniform",
    "start": 2.1,
    "end": 3.72,
    "probability": 0.1384
   },
   {
    "word": "Lima,",
    "start": 3.72,
    "end": 4.92,
    "probability": 0.205
   },
   {
    "word": "stand",
    "start": 6.2,
    "end": 6.32,
    "probability": 0.2401
   },
   {
    "word": "by.",
    "start": 6.32,
    "end": 8.58,
    "probability": 0.9913
   },
   {
    "word": "Alpha",
    "start": 9.22,
    "end": 10.62,
    "probability": 0.9277
   },
   {
    "word": "Charlie",
    "start": 10.62,
    "end": 12.02,
    "probability": 0.9534
   },
   {
    "word": "Four",
    "start": 12.02,
    "end": 13.52,
    "probability": 0.1456
   },
   {
    "word": "Alpha",
    "start": 13.52,
    "end": 15.14,
    "probability": 0.5734
   },
   {
    "word": "Uniform",
    "start": 15.14,
    "end": 16.56,
    "probability": 0.7651
   },
   {
    "word": "Lima,",
    "start": 16.56,
    "end": 18.0,
    "probability": 0.9936
   },
   {
    "word": "stand",
    "start": 18.82,
    "end": 19.16,
    "probability": 0.9727
   },
   {
    "word": "by.",
    "start": 19.16,
    "end": 19.54,
    "probability": 0.9962
   },
   {
    "word": "Alpha",
    "start": 20.94,
    "end": 22.22,
    "probability": 0.989
   },
   {
    "word": "Charlie",
    "start": 22.22,
    "end": 23.5,
    "probability": 0.9975
   },
   {
    "word": "Four",
    "start": 23.5,
    "end": 24.8,
    "probability": 0.9608
   },
   {
    "word": "Alpha",
    "start": 24.8,
    "end": 26.3,
    "probability": 0.932
   },
   {
    "word": "Uniform",
    "start": 26.3,
    "end": 27.8,
    "probability": 0.9772
   },
   {
    "word": "Lima,",
    "start": 27.8,
    "end": 29.0,
    "probability": 0.9883
   },
   {
    "word": "stand",
    "start": 29.54,
    "end": 30.34,
    "probability": 0.9876
   },
   {
    "word": "by.",
    "start": 30.34,
    "end": 30.68,
    "probability": 0.9978
   },
   {
    "word": "Alpha",
    "start": 35.7,
    "end": 36.4,
    "probability": 0.6748
   },
   {
    "word": "Charlie",
    "start": 36.4,
    "end": 37.84,
    "probability": 0.0127
   },
   {
    "word": "Four",
    "start": 37.84,
    "end": 39.18,
    "probability": 0.0125
   },
   {
    "word": "Alpha",
    "start": 39.18,
    "end": 40.88,
    "probability": 0.8281
   },
   {
    "word": "Uniform",
    "start": 40.88,
    "end": 42.46,
    "probability": 0.6368
   },
   {
    "word": "Lima",
    "start": 42.46,
    "end": 43.7,
    "probability": 0.8201
   },
   {
    "word": "Uniform",
    "start": 43.7,
    "end": 45.32,
    "probability": 0.9471
   },
   {
    "word": "Kilo",
    "start": 45.32,
    "end": 46.72,